Page_link,Redirected_link,Title,Page_info,Body
https://aitnews.com/?p=11,https://aitnews.com/2005/09/26/%d9%84%d9%8a%d9%86%d9%88%d9%81%d9%88-%d8%aa%d8%b7%d8%b1%d8%ad-%d8%a3%d8%b5%d8%ba%d8%b1-%d9%88%d8%a3%d8%ae%d9%81-%d9%83%d9%85%d8%a8%d9%8a%d9%88%d8%aa%d8%b1-%d9%85%d8%ad%d9%85%d9%88%d9%84-%d9%81%d9%8a/,لينوفو تطرح أصغر وأخف كمبيوتر محمول في الشرق الأوسط خلال جايتكس 2005,26 سبتمبر 2005 آخر تحديث: 30 أبريل 2023,"ضمن فعاليات معرض جيتكس 2005 أعلنت اليوم شركة لينوفو عن جهاز الكمبيوتر المحمول ثنك باد من سلسلةz (ThinkPad Z-Series)، والذي يعد أول جهاز ثنك باد ذو شاشة عريضة مزود بأحدث تقنيات الوسائط المتعددة. ويجيء طرح الجهاز الجديد في أسواق الشرق الأوسط متزامنا مع طرحه في الأسواق العالمية. لقد صممت أجهزة الكمبيوترات المحمولة ThinkPad Z-Series خصيصا للمستخدمين من رجال الأعمال دائمي الحركة والتنقل, ولمستخدمي الأعمال الصغيرة الذين يعتمدون على كمبيوتراتهم المحمولة اعتمادا كبيرا سواء في العمل أو في حياتهم اليومية. علق السيد ميلكو فان دوجيل، المدير العام، مجموعة لينوفو، خلال إطلاق الجهاز الجديد في معرض جيتكس بالأمس، قائلا:” نحن نعد العدة لطرح جهاز ThinkPad Z-series منذ وقت طويل، ونحن نعرف أن عملاءنا يتحرقون شوقا لوصوله. لذلك فإنه يسعدنا الإعلان عن بدء توفره في جميع أسواق الشرق الأوسط منذ اليوم، وفي نفس وقت ظهوره في الأسواق العالمية.” بالإضافة إلى التصميم الكلاسيكي لأجهزة الثنك باد ذات اللون الأسود، فإن Z Series متوفرة أيضافي إصدار خاص في هيكل من التيتانيوم الخشن 2 . إن التيتانيوم يمنح الثنك باد، إحدى أشهر علامات الكمبيوتر المحمول التجارية في العالم، منظرا أنيقا وعصريا، ويضفي عليه متانة وقدرة فريدة على مقاومة الخدوش والصدمات. إن شاشة جهاز ThinkPad Z60m’s الذي تبلغ مساحتها 15.4 إنش تمنح المستخدم مساحة أكبر لعرض البيانات بنسبة 30% مقارنة بشاشات XGA – 15 إنش التقليدية، كما توفر له زاوية أفضل للرؤية خصوصا عند استخدام الكمبيوتر المحمول خلال رحلات الطيران. أما جهاز الثنك باد ThinkPad Z60t ، مع شاشة 14 إنش، فلا يتجاوز سمكه 1.1 إنش، ولا يزيد وزنه عن 4.2 رطلا، مما يجعله أصغر وأخف كمبيوتر محمول ذي شاشة عريضة في فئته 1. يقدم ThinkPad Z60t مساحة أكبر لعرض البيانات بنسبة 25% مقارنة بشاشات XGA -14 إنش التقليدية، أي ما يعادل أربعة أعمدة جداول حسابية، لكي يقدم حلا مثاليا للمستخدمين من رجال الأعمال الذين يعملون عادة على أكثر من تطبيق في نفس الوقت.
كما تتمتع السلسلة بتشكيلة متنوعة من إمكانيات الوسائط المتعددة الجديدة والمبتكرة، والتي تشمل مفاتيح للتحكم السريع بوظائف التطبيقات ومنافذ الجهاز، لتحميل الصور الرقمية وملفات الفيديو بسرعة وسهولة، والتي تجعل من أجهزة Z-Series مثالية للاستخدامات العملية والمنزلية، كالعروض التوضيحية، وتطبيقات الوسائط المتعددة، ومشاهدة أفلام الدي. في. دي. كما ازدادت أهمية الوقت لدرجة كبيرة حتى أصبحت الشركات الصغيرة تبحث عن تكنولوجيا لا تساعدهم على تحسين إنتاجيتهم العملية فحسب، بل تساعدهم أيضا على تحقيق أقصى استفادة ممكنة من أوقات فراغهم، سواء
في المنزل أو عند السفر.” القفص الأسطواني يطيل من فترة بقاء الكمبيوتر المحمول
كما تقدم Z-Series للمستخدمين دائمي السفر والترحال هيكلا متينا يحمي الجهاز كدرع داخلي، أو القفص الأسطواني الذي تشتهر به أجهزة الثنك باد، والذي يمكنه أن يقلل من احتمالية تضرر مكونات الجهاز الداخلي نتيجة الصدمات أو السقوط بنسبة 30%. إن جميع مكونات الجهاز الداخلية، ويشمل ذلك القرص الصلب، مثبتة على قفص واحد من المغنيزيوم، الذي يشكل درعا دفاعيا أقوى من الهياكل التقليدية، ودون أن يكون له أي تأثر سلبي على الأداء أو سهولة حمل الجهاز واستخدامه. فإذا أضفنا أيضا نظام لينوفو للحماية الفعالة، أحد تقنيات ثنك فانتايج، فإن قفص ثنك باد الاسطواني، يصبح نظاما فعالا لحماية الكمبيوتر الشخصي من تعطل القرص الصلب، وهي من أصعب المشاكل التي تواجه المستخدمين وتكلفهم كثيرا من الجهد والوقت والمال. سوف يتم تقديم القفص الاسطواني في كمبيوترات سلسلة الزد Z-Series وكذلك في موديلات الثنك باد القادمة. أناقة ومتانة
يحتضن شاشة TFT العريضة هيكل من التيتانيوم الخشن، في بعض الإصدارات الخاصة من السلسلة، يتمتع بالقدرة الهائلة على التحمل ومقاومة الخدوش والصدمات. أما مجموعة المفاتيح الجديدة للتعامل مع نظام تشغيل ويندوز والوسائط المتعددة والتطبيقات فإنها تحسن من لوحة مفاتيح ثنك باد الكاملة ذات السمعة الأسطورية 3. وضعت لينوفو سماعتي الستيريو في موقع استراتيجي على جانبي لوحة المفاتيح، لتضمن صوتا نقيا وجليا وبالإضافة إلى إمكانيات الوسائط المتعددة الكثيرة، هنالك تشكيلة من المنافذ لوصل أي نوع من الأجهزة الطرفية،والتي تتراوح من منافذ USB 2.0 إلى وصلات الفيديو الفائق S-Video، والفي. جي. إي. VGA و IEEE1394. كما يزهو جهاز Z60m بقارئة بطاقات الوسائط المتعددة الثلاثية 3-1. تقنيات ثنك فانتايج تسهل تجربة استخدام الجهاز
إن تقنيات ثنك فانتايج من لينوفو تقدم تشكيلة متنوعة من الإمكانيات الفريدة من خلال لوحة تحكم مركزية تحمي الكمبيوتر الشخصي وتجعل استخدامه أسرع وأيسر. وتأتي كمبيوترات سلسلة الزد Z-Series مزودة بأحدث إصدارات نظام ثنك فانتايج لحماية المستخدم ThinkVantage Client Security Solution، والذي يتيح للمستخدمين استرجاع كلمات السر الضائعة بأنفسهم. كما تشكل تقنيات ثنك فانتايج أداة مبسطة وقوية لتشفير القرص الصلب، وبرنامج محسن لإدارة كلمات السر، وبرنامج للتحقق من حماية النظام للتأكد من أن المستخدم قد فعل كل ما عليه فعله لحماية نظامه وأمنه."
https://aitnews.com/?p=12,https://aitnews.com/2005/09/26/%d8%b4%d8%b1%d9%83%d8%a9-ati-%d8%a8%d8%b5%d8%af%d8%af-%d8%b7%d8%b1%d8%ad-%d8%a7%d9%84%d8%ac%d9%8a%d9%84-%d8%a7%d9%84%d8%ab%d8%a7%d9%86%d9%8a-%d9%85%d9%86-%d8%b4%d8%b1%d8%a7%d8%a6%d8%ad-%d8%b1%d8%a7/,شركة ATI بصدد طرح الجيل الثاني من شرائح راديون في الخامس من أكتوبر القادم,26 سبتمبر 2005 آخر تحديث: 30 أبريل 2023,تعتزم شركة (ATI) طرح منتجها (Radeon X1800 – aka R520) يوم الأربعاء الموافق للخامس من أكتوبر. حيث وضعت الشركة المتخصصة في إنتاج بطاقات الجرافيكس عدادًا على موقعها يقوم بالعد التنازلي لطرح منتجاتها كفكرة مبتكرة تسارع نبضات قلب من ينتظرها. كما وضعت الشركة أسفل العداد المعادلة الغامضة d/t = V (التاريخ /التوقيت=الخامس)، مع عدم الإشارة إلى ما الذي سيحدث بعد أن يصل العداد للصفر. وبدون شك لم تختلق شركة (ATI) هذه الضجة لطرح أي منتج إلا لبطاقات (X1800) أو المنتج الذي طال انتظاره (CrossFire). فإذا كان العداد يشير إلى (X1800)، فسيتم طرحه تقريبًا بعد أسبوع من ميعاد وصوله لمراكز البيع. وذلك بعد طرح شركة (Nvidia) شرائح (GeForce Go 7800GTX) يوم غد الأربعاء الموافق 28 سبتمبر. فغالبًا ما تريد شركة (ATI) ترك بعض المجال لمنتجها الجديد حتى ينفرد على الساحة.
https://aitnews.com/?p=13,https://aitnews.com/2005/10/02/%d8%a2%d8%a8%d9%84-%d8%aa%d8%ae%d8%b7%d8%b7-%d9%84%d8%b7%d8%b1%d8%ad-%d9%83%d9%85%d8%a8%d9%8a%d9%88%d8%aa%d8%b1-%d9%85%d8%ad%d9%85%d9%88%d9%84-%d9%85%d8%b2%d9%88%d8%af-%d8%a8%d9%83%d8%a7%d9%85%d9%8a/,آبل تخطط لطرح كمبيوتر محمول مزود بكاميرا ويب مدمجة,2 أكتوبر 2005 آخر تحديث: 30 أبريل 2023,نشرت دائرة تسجيل العلامات التجارية وبراءات الاختراع الأمريكية تقدم شركة (Apple) بطلب تسجيل براءة اختراع لكمبيوتر محمول يتضمن كاميرا في الجزء الذي يربط غطاء الكمبيوتر بقاعدته. وتحتوي الكاميرا المدمجة بالكمبيوتر، على أداة استشعار ومجموعة عدسات، وذلك وفقًا للمستندات الموجودة على موقع الوكالة الحكومية على الإنترنت. ويذكر الموقع أن آبل تقدمت بطلب تسجيل براءة الاختراع للكمبيوتر الجديد في مارس 2004، إلا أنه لم يتم الموافقة عليه بعد. وعلى صعيد آخر رفض المتحدث الرسمي للشركة الكشف فيما إذا كانت الشركة تعتزم إدخال هذه الميزة في أي من منتجاتها القادمة أم لا، وقال أن الشركة لا تعلق على “الإشاعات والتوقعات”. علمًا بأنه تم نشر صورة للجهاز المقترح في الصفحة الأولى لطلب براءة الاختراع في موقع الدائرة على شبكة الإنترنت. والجدير بالذكر أن الشركات المصنعة لأجهزة الكمبيوتر الأخرى، بما في ذلك سوني، قد قامت بطرح أجهزة كمبيوتر محمولة مزودة بكاميرا ويب مدمجة في الأسواق. أما شركة آبل فلم تطرح أي كمبيوتر محمول أو مكتبي مزود بكاميرا إلى الآن، بيد أنها تنتج كاميرات الويب من طراز (iSight) كخيار إضافي يبلغ سعره 149 دولارًا أمريكيًا.
https://aitnews.com/?p=14,https://aitnews.com/2005/10/02/%d8%a7%d8%b9%d8%aa%d8%b2%d8%a7%d9%85-%d8%b4%d8%b1%d9%83%d8%a9-%d8%a5%d9%84-%d8%ac%d9%8a-%d8%b7%d8%b1%d8%ad-%d8%a8%d8%b7%d8%a7%d8%b1%d9%8a%d8%a9-%d8%aa%d8%b9%d9%85%d9%84-%d8%b9%d9%84%d9%89-%d8%a7%d9%84/,اعتزام شركة إل جي طرح بطارية تعمل على الوقود للكمبيوترات المحمولة,2 أكتوبر 2005 آخر تحديث: 30 أبريل 2023,تعتزم شركة إل جي طرح نظام تزويد بالطاقة يعمل بالوقود خاص بأجهزة الكميبوترات المحمولة خلال العام القادم. وتتميز بطارية الوقود، التي قام بتطويرها معمل إل جي الكيميائي، بقدرتها على توليد طاقة بقدار 25 وات أي تشغيل أجهزة الكمبيوتر لما يزيد عن يزيد عن 4000 ساعة، مما يجعلها تتفوق بثمان ساعات عن المنتجات المنافسة. وأضاف أنه على الرغم من تصميمها خصيصًا لأجهزة الكمبيوتر المحمولة، إلا إنها تتمتع بإمكانية تشغيل الأجهزة الكفية مثل مشغلات الوسائط والهواتف المحمولة من خلال توصيلها بمنافذ USB. هذا وقد أظهرت صور الشركة أنه لم يصل حجم النموذج الأولي إلى صغر الحجم المنشود، في حين تزن أقل من 1 كيلو غرام. إلا أن شركة إل جي تسعى إلى تطوير وحداتها التي تنفرد بميزة توليد طاقة تتراوح بين 5 وات و50 وات، مما يعني تطوير أجهزة أصغر حجماً. والجدير بالذكر أن شركة توشيبا تسعى لتلعب دورًا في سوق وحدات التزويد بالطاقة إلا أنه من المتوقع عدم تحقيق ذلك قبل حلول عام 2007.
https://aitnews.com/?p=15,https://aitnews.com/2005/10/03/%d9%83%d9%85%d8%a8%d9%8a%d9%88%d8%aa%d8%b1-%d9%84%d9%84%d9%81%d9%82%d8%b1%d8%a7%d8%a1-%d9%81%d9%8a-%d8%a7%d9%84%d9%88%d9%84%d8%a7%d9%8a%d8%a7%d8%aa-%d8%a7%d9%84%d9%85%d8%aa%d8%ad%d8%af%d8%a9-%d9%85/,كمبيوتر للفقراء في الولايات المتحدة من شركة AMD,3 أكتوبر 2005 آخر تحديث: 30 أبريل 2023,تعتزم شركة AMD بالتعاون مع شركة Radio Shack طرح كمبيوتر محدود التكاليف في المناطق النامية في الولايات المتحدة. ويناسب هذا الجهاز احتياجات الطلاب وراغبي الوصول إلى الإنترنت ممن يستخدمون برامج معالجة النصوص والإنترنت ولايحتاجون الإمكانيات المعقدة لأجهزة شركتي ديل وHewlett-Packar. ويتميز الجهاز بحجمه الصغير ووزنه الذي لا يتعدى ثلاثة أرطال، ويحتوي على منفذ USB ومحرك أقراص ثابت ووصلات سماعات ومايكروفون ولا يحتوي على مروحة. كما يتضمن الجهاز ماوس ولوحة مفاتيح بينما لا يحتوي على شاشة. ويتم به تثبيت برامج مايكروسوفت إنترنت إكسبلورر وباور بوينت وماكروميديا فلاش بلاير ومعالج النصوص SoftMaker وبرامج الجداول الإلكترونية. وكان المستهدف الرئيسي من فكرة هذا الكمبيوتر القرويين في الهند ومحدودي الدخل في البرازيل. ولكن من المتوقع أن يطمح المستهلكون الأمريكيون من محدودي المستوى المعيشي في الحصول على جهاز لا يتعدى سعره 299 دولار. وبدأ بيع جهاز PIC موصل الإنترنت الشخصي من خلال شركة راديو شاك. وكانت شركة AMD قد بدأت بالفعل طرح المنتج في الهند منذ عام. وتطمح شركة AMD في توصيل نسبة 50 % من سكان العالم بالإنترنت بحلول عام 2015. بينما تصل هذه النسبة في الوقت الحالي إلى 15%. ومن المتوقع أن تضيف AMD الصين وتركيا إلى قائمة الأسواق النامية التي تحتاج إلى هذه الأجهزة في الشهور القليلة القادمة. وجاري الآن التوجه نحو بيعه في روسيا. كما أعلنت شركة AMD عن تبرعها بأجهزة PIC للمتضررين من إعصار كاترينا حتي يمكنهم الاتصال بذويهم. ويتوفر هذا الجهاز الآن في الهند والبرازيل والمكسيك ويتم بيعه بأقساط بسيطة من خلال شركات الاتصالات. يذكر أن الكمبيوتر الجديد سيتم بيعه تحت اسم Presidian.
https://aitnews.com/?p=16,https://aitnews.com/2005/10/04/%d8%b3%d9%88%d8%a7%d9%82%d8%a9-%d8%ac%d8%af%d9%8a%d8%af%d8%a9-%d9%85%d9%86-%d8%aa%d9%88%d8%b4%d9%8a%d8%a8%d8%a7-%d9%84%d9%84%d9%83%d9%85%d8%a8%d9%8a%d9%88%d8%aa%d8%b1%d8%a7%d8%aa-%d8%a7%d9%84%d8%af/,سواقة جديدة من توشيبا للكمبيوترات الدفترية,4 أكتوبر 2005 آخر تحديث: 30 أبريل 2023,"تعتزم شركة توشيبا طرح نسخة تجريبية من سواقة جديدة قليلة السماكة خاصة بأجهزة الكمبيوترات الدفترية لتشغيل اسطوانات HD DVD. وتبلغ أبعاد السواقة الجديدة (TS-L802A ) 12.8 × 12.6 × 1.3 سم وتزن 160 جرام، وتحتوي على ذاكرة سعتها 8 ميغابايت. كما تتمتع السواقة الجديدة بإمكانية تشغيل اسطوانات HD DVD وتدعم كل من التنسيقات التالية: (8x DVD-ROM, 24x CD-ROM, 3x DVD-RAM, 4x DVD-R/RW, 4x DVD-R dual-layer, 4x DVD+R/RW, 2.4x DVD+R dual-layer, 16x CD-R and 10x CD-RW). وهكذا فإنها تدعم كافة الأنساق ماعدا (Blu-ray وnatch). يذكر أنه سيتم عرض المنتج للمرة الأولى في معرض CEATEC باليابان، ولكن الشركة أعلنت عن توقعاتها عن بدء إصداره في نهاية العام الحالي. ولم تصرح الشركة عن السعر المقترح للمنتج إلا أن الخبراء لا يتوقعون أن يكون سعره متواضعًا فهو يتمتع بتكنولوجيا الليزر الأحمر والليزر الأزرق. يذكر أن شركة توشيبا كانت قد أعلنت في أكتوبر 2004 عن عزمها طرح جهاز كمبيوتر كفي يدعم تشغيل اسطوانات HD DVD في الربع الرابع من عام 2005."
https://aitnews.com/?p=17,https://aitnews.com/2005/10/05/%d8%b4%d8%b1%d9%83%d8%a9-gigabyte-%d8%aa%d8%b9%d9%8a%d8%af-%d8%a5%d9%86%d8%aa%d8%a7%d8%ac-%d8%a8%d8%b7%d8%a7%d9%82%d8%a7%d8%aa-ramdisk/,شركة Gigabyte تعيد إنتاج بطاقات RAMdisk,5 أكتوبر 2005 آخر تحديث: 30 أبريل 2023,كشفت شركة (Gigabyte) النقاب عن وسائط التخزين الجديدة ((i-RAM، كبديل للتخزين على القرص الصلب والذي يعتمد على شرائح (DDR SDRAM) السريعة عوضاً عن ذاكرة الفلاش البطيئة. إلا أن ثمة عيب وحيد مع هذا المنتج الجديد يتمثل في كونه غير مناسب للأنظمة التي يتم إيقاف تشغيلها لفترات طويلة. كما إنه ليس مناسبًا أيضًا لأي شخص يرغب في مساحة تخزين أكبر من 4 غيغابايت. وبطاقات (i-RAM) الجديدة هي عبارة عن بطاقة (PCI) تحتوي على أربع فتحات (DIMM) تتسع لتخزين 4 غيغا بايت. ويتميز أيضًا ببطارية قابلة لإعادة الشحن لتشغيل الذاكرة عند إيقاف تشغيل النظام المضيف. وصرحت شركة (Gigabyte) أن مصدر طاقة البطاقة يدوم لفترة من 10 إلى 16 ساعة. وبالطبع يتم مسح الذاكرة بعد ذلك. ويذكر أن الفكرة التي يعتمد عليها هذا المنتج هي فكرة معروفة. فطريقة تقسيم جزء من ذاكرة الكمبيوتر واعتبارها قرص صلب ظاهري هي طريقة اتبعتها العديد من أنظمة التشغيل على مدار الأعوام الماضية. إلا أن الحاجة إلى نسخ البيانات إلى وسيط ثابت قبل إيقاف تشغيل الكمبيوتر أعاقت دائمًا الاستفادة الكاملة من الفكرة. وأضافت شركة (Gigabyte) أنه يتم تشغيل ويندوز إكس بي من على (i-RAM) في وقت لا يتجاوز 1/30 من الوقت الذي يستغرقه بدء التشغيل من القرص الصلب. علمًا بأن امتلاك i-RAM لا يغني عن استخدام القرص الصلب وبالتالي لا تشكل مساحة البطاقة ميزة كبيرة.
https://aitnews.com/?p=18,https://aitnews.com/2005/10/07/%d8%a5%d9%86%d9%81%d9%8a%d8%af%d9%8a%d8%a7-%d8%aa%d8%b9%d8%aa%d8%b2%d9%85-%d8%b7%d8%b1%d8%ad-%d8%b4%d8%b1%d9%8a%d8%ad%d8%a9-%d8%a7%d9%84%d8%ac%d8%b1%d8%a7%d9%81%d9%8a%d9%83%d8%b3-g72-%d9%81%d9%8a/,إنفيديا تعتزم طرح شريحة الجرافيكس G72 في بداية العام القادم,7 أكتوبر 2005 آخر تحديث: 30 أبريل 2023,تعتزم شركة نيفيديا طرح شريحة الجرافيكس G72 (تسعين نانو) في بداية العام القادم . ويأتي الكشف عن الوحدة الجديدة بعد طرح شريحة (GeForce 7800) المتوفرة حالياً في الأسواق ( 110 نانومتر)، لذا من المفترض بعد إصدار الوحدة الجديدة أن تقوم شركة نيفيديا بإعادة تقييم أسعار منتجاتها. وتأتي هذه الأخبار في الوقت الذي كشفت فيه شركة ATI أكثر المنافسين لإنفيديا عن سلسلة Radeon X1000 وهي الجيل الجديد من شرائح الجرافيكس Shader Model 3.0.
https://aitnews.com/?p=19,https://aitnews.com/2005/10/07/%d8%b4%d8%b1%d9%83%d8%a9-%d8%af%d9%8a%d9%84-%d8%aa%d8%b7%d8%b1%d8%ad-%d9%83%d9%85%d8%a8%d9%8a%d9%88%d8%aa%d8%b1-%d8%b4%d8%ae%d8%b5%d9%8a-%d9%84%d9%84%d8%a8%d8%b1%d8%a7%d9%85%d8%ac-%d8%b0%d8%a7%d8%aa/,شركة ديل تطرح كمبيوتر شخصي للبرامج ذات المصادر المفتوحة,7 أكتوبر 2005 آخر تحديث: 30 أبريل 2023,بدأت شركة ديل مؤخراً بطرح كمبيوتر مكتبي جديد بالأسواق بدون تثبيت أي نظام تشغيل مثبت. وصمم الجهاز للأشخاص الراغبين في تشغيل برنامج مفتوح المصدر مثل لينوكس بدلاً من ويندوز. ويتمتع الكمبيوتر المكتبي الجديد بميزة القرص الصلب الفارغ بالإضافة إلى نسخة من نظام التشغيل (FreeDOS)، الذي يستطيع المستهلك تثبيته. ويعد الكمبيوتر جزء من سلسلة أجهزة الكمبيوتر n التي تقدمها شركة ديل، والتي كان أول طرح لها في الأسواق في سبتمبر 2002. ويذكر أن سعر الجهاز 849 دولارًا أمريكيًا وهو مزود بمعالج بنتيوم 4 وذاكرة كمبيوتر 512 ميغا بايت من (DDR) المتطورة بالإضافة إلى بطاقة فيديو (ATI Radeon X300SE) ذات الذاكرة السريع والتي تصل إلى 128 ميغا بايت فضلاً عن ميزة الضمان لمدة عام. ويستهدف الكمبيوتر المكتبي الجديد الأفراد والشركات الذين يرغبون في تجربة لينكس وأنظمة التشغيل ذات المصدر المفتوح. فالعديد من الشركات الكبرى التي اشترت ويندوز بإعادة ترخيصه كان عليها مسح كل برنامج المصنع ثم تثبيت برنامج بديل من اختيارهم. وسيوفر شراء كمبيوتر شخصي بدون نظام تشغيل كثيرًا من العناء كما سيوفر على المستهلك تكلفة البرنامج الإضافية.
