Page_link,Redirected_link,Title,Page_info,Body
https://aitnews.com/?p=20,https://aitnews.com/2005/10/10/%d8%b4%d8%b1%d9%83%d8%a9-%d8%b3%d9%88%d9%86%d9%8a-%d8%aa%d9%83%d8%b4%d9%81-%d8%b9%d9%86-%d8%b4%d8%b1%d8%a7%d8%a6%d8%ad-%d8%a7%d9%84%d8%b0%d8%a7%d9%83%d8%b1%d8%a9-%d8%a7%d9%84%d8%ac%d8%af%d9%8a%d8%af/,شركة سوني تكشف عن شرائح الذاكرة الجديدة Micro,10 أكتوبر 2005 آخر تحديث: 30 أبريل 2023,كشفت شركتي سوني وسانديسك مؤخراً عن أحدث بطاقات الذاكرة من طراز (Micro). ويبلغ حجم بطاقة الذاكرة المصغرة 15 × 12.5 × 1.2 مم فقء أي إنها ليست في صغر حجم بطاقة (Micro SD)، والتي قامت شركة سانديسك بتطويرها أيضًا والمعروفة سابقًا باسم (TransFlash). وهي بطاقات مصممة للهواتف المتحركة. وتمتاز بطاقات شرائح الذاكرة (Micro) بإمكانية نقل ما يصل إلى 160 ميغا بت في الثانية. وتتوقع شركة سوني من خلال هذا التنسيق الجديد توفير إمكانية تخزين ما يصل إلى 32 غيغابايت من البيانات وهذا هو الحد الأقصى نظريًا. أما الحد الفعلي فسنعرفه عندما يتم طرحها في الأسواق خلال النصف الأول من عام 2006.
https://aitnews.com/?p=21,https://aitnews.com/2005/10/15/%d8%a5%d8%aa%d8%b4-%d8%a8%d9%8a-%d8%aa%d8%b3%d8%ad%d8%a8-135-%d8%a3%d9%84%d9%81-%d8%a8%d8%b7%d8%a7%d8%b1%d9%8a%d8%a9-%d9%84%d9%84%d9%83%d9%85%d8%a8%d9%8a%d9%88%d8%aa%d8%b1%d8%a7%d8%aa-%d8%a7%d9%84/,إتش بي تسحب 135 ألف بطارية للكمبيوترات المحمولة من الأسواق,15 أكتوبر 2005 آخر تحديث: 30 أبريل 2023,شنت شركة (HP) مؤخراً حملة كبرى لسحب 135 ألف بطارية تم بيعها مع أجهزة الكمبيوتر المحمولة التي تنتجها الشركة والتي تم تصديرها لجميع أنحاء العالم من مارس 2004 إلى مايو 2005. وصرحت الشركة أن هناك 85 ألف بطارية ليثيوم قابلة لإعادة الشحن معطوبة في الولايات المتحدة الأمريكية. ووضحت أنه تم سحب المنتج بناءً على استلامها 16 تقرير حول درجة حرارة البطارية المفرطة الناجمة عن حدوث خلل في الدائرة الكهربائية. ولقد تم الإعلان عن أربع حالات، واحدة منها في الولايات المتحدة الأمريكية، حيث تسببت هذه البطاريات في حدوث تلف طفيف بالممتلكات نتج عن ذوبان حافظات البطارية واحتراقها. ويذكر أن هذا المنتج عليه ملصق يبدأ بالكود GC أوIA أوL0 أو L1. ولقد بيعت البطارية كوحدة منفصلة بسعر 100 دولار أمريكي و130 دولارًا أمريكيًا. ونصحت الشركة المصنعة المستهلكين بعدم استخدام البطاريات المسحوبة والاتصال بشركة إتش بي للحصول على بديل مجاني من خلال موقع ويب برنامج الاستبدال.
https://aitnews.com/?p=22,https://aitnews.com/2005/10/16/%d8%b3%d8%a7%d9%85%d8%b3%d9%88%d9%86%d8%ac-%d8%ab%d8%a8%d8%aa%d8%aa-%d8%a7%d9%84%d8%a3%d8%b3%d8%b9%d8%a7%d8%b1-%d9%88%d8%ae%d8%af%d8%b9%d8%aa-%d8%a7%d9%84%d9%85%d8%b3%d8%aa%d9%87%d9%84%d9%83%d9%8a/,سامسونج ثبتت الأسعار وخدعت المستهلكين,16 أكتوبر 2005 آخر تحديث: 30 أبريل 2023,تم فرض غرامة قدرها 300 مليون دولار أمريكي على الشركة المتخصصة في صناعة شرائح الذاكرة سامسونج وذلك بسبب تآمرها لتثبيت سعر شرائح الذاكرة (RAM) مع منافسيها وخداع المستهلكين. وقد جاءت الغرامة بعد الاعتراف بالجريمة الشنعاء وفرض غرامة على المنافسين هينكس وإنفينيون. ويذكر أنه قد تم إدانة سبعة موظفين من موظفي شركة سامسونج بتهمة تورطهم في عملية الاحتيال هذه. حيث دبرت شركة سامسونج مؤامرة بدأت عام 1999 حتى عام 2002 مع هينكس وإنفينيون لتثبيت أسعار شرائح الذاكرة. مما يعني أن على كل من شركة ديل وكومباك وإتش بي وآبل وآي بي إم وجيت واي شراء شرائح الذاكرة (RAM) بسعر أكبر من السعر الذي عليهم دفعه. مما أدى إلى رفع كلا من شركة ديل وآبل لأسعار أجهزة الكمبيوتر بينما قللت الشركات الأخرى من حجم شريحة الذاكرة ((RAM المثبتة على أجهزة الكمبيوتر. ولقد شك المحققون في وجود مؤامرة ما عندما بدأت أسعار شرائح الذاكرة في الارتفاع على الرغم من انخفاض أسعار باقي مستلزمات الكمبيوتر. إلا أنهم ظنوا في بادئ الأمر أن ذلك بسبب قلة التوريد، لكن الرئيس التنفيذي لشركة ديل مايكل ديل فضح الأمر وأخبر السلطات أن هناك اتفاق شبه احتكاري بين الشركات المصنعة للشرائح.
https://aitnews.com/?p=23,https://aitnews.com/2005/10/17/%d8%b4%d8%b1%d9%83%d8%a9-%d8%a5%d9%86%d9%81%d9%8a%d8%af%d9%8a%d8%a7-%d8%aa%d8%b7%d8%b1%d8%ad-%d8%b4%d8%b1%d9%8a%d8%ad%d8%a9-geforce-6800-gs/,شركة إنفيديا تطرح شريحة Geforce 6800 GS,17 أكتوبر 2005 آخر تحديث: 30 أبريل 2023,قدمت شركة Nvidia في إطار منافستها مع شركة ATI في مجال صناعة الشرائح شريحة جديدة باسم Geforce 6800 GS، وهي امتداد للشريحة السابقة 6800GT وتحتوي على واجهة ذاكرة بتقنية 256 بت ويصل سعر البطاقة الجديدة 249 دولار. وتُعد شريحة نيفيديا بمثابة صفعة لشريحة X1600XT التي طورتها شركة ATI، والتي تحتوي على ذاكرة بتقنية 128 بت فقء مما وضع شركة ATI في وضع لا تحسد عليه. هذا ومن المتوقع أن تتوفر شريحة Geforce 6800 GS في الأسواق خلال الأسابيع القليلة القادمة.
https://aitnews.com/?p=24,https://aitnews.com/2005/10/17/%d8%b4%d8%b1%d8%b7%d8%a9-%d8%b7%d9%88%d9%83%d9%8a%d9%88-%d8%aa%d8%b3%d8%aa%d8%b9%d9%8a%d9%86-%d8%a8%d8%a7%d9%84%d9%87%d9%88%d8%a7%d8%aa%d9%81-%d8%a7%d9%84%d9%85%d8%ad%d9%85%d9%88%d9%84%d8%a9-%d9%81/,شرطة طوكيو تستعين بالهواتف المحمولة في مكافحة الجريمة,17 أكتوبر 2005 آخر تحديث: 30 أبريل 2023,استغلت شرطة طوكيو الهواتف المحمولة في تبادل صور المشتبه فيهم وأماكن وقوع الجريمة بالإضافة إلى الحصول على معلومات حول التحقيقات. حيث كشفت صحيفة (Mainichi Shimbun) اليابانية يوم الجمعة عن تقرير يشير إلى قيام شرطة طوكيو بتشغيل نظام (P-Mode) بالتعاون مع شركة الهواتف المحمولة اليابانية (NTT DoCoMo) لمكافحة الجريمة. وعلق مصدر مسئول في شرطة طوكيو قائلاً “تعتبر قدرتنا السريعة على رؤية مكان وقوع الجريمة والوصول إلى معلومات حول التحقيقات أمرًا بالغ الأهمية. ونأمل في تحسين نظام (P-Mode) والاستفادة منه بشكل أكبر في جهودنا للقبض على المجرمين”. يذكر أن قسم شرطة ميتروبوليتان قام هذا الشهر بتوفير5250 هاتف محمول إضافي لمراكز الشرطة البالغ عددها 101 مركزًا حتى يتمكن أفراد الشرطة من الوصول إلى المعلومات الموجودة في مراكز الشرطة الرئيسية.
https://aitnews.com/?p=25,https://aitnews.com/2005/10/18/%d8%a5%d9%86%d8%aa%d9%84-%d8%aa%d9%82%d9%84%d9%84-%d9%85%d9%86-%d9%81%d8%aa%d8%b1%d8%a9-%d8%a8%d8%af%d8%a1-%d8%aa%d8%b4%d8%ba%d9%8a%d9%84-%d8%a7%d9%84%d9%83%d9%85%d8%a8%d9%8a%d9%88%d8%aa%d8%b1-%d8%a7/,إنتل تقلل من فترة بدء تشغيل الكمبيوتر المزعجة,18 أكتوبر 2005 آخر تحديث: 30 أبريل 2023,أزاحت شركة إنتل الستار عن التقنية الجديدة التي تسمى (Robson) والتي تقلل من وقت تشغيل الكمبيوتر المزعج. فبفضل هذه التقنية، بإمكان الكمبيوتر تشغيل التطبيقات من بطاقة ذاكرة الفلاش الإضافية وبرنامج إنتل عوضًا عن قرص الكمبيوتر الصلب. وتتميز ذاكرة الفلاش باستجابة أسرع من استجابة الأقراص الصلبة، مما يؤدي إلى التقليل من الوقت المستغرق لفتح تطبيق ما. مما يعني أنه بإمكان مستخدمي أجهزة الكمبيوتر المحمولة التمتع بعمر أطول للبطارية بسبب توفير الطاقة المستهلكة في تشغيل محرك القرص الصلب. وأشادت المتحدثة باسم شركة إنتل بتقنية (Robson) قائلة أنها تقنية تنفرد بميزة تقليل مقدار الوقت المستغرق بين الضغط على زر تشغيل الكمبيوتر وعمل الكمبيوتر بالفعل والوقت المستغرق للانتقال من حالة السكون إلى حالة النشاط والوقت المستغرق لبدء تشغيل التطبيق. وتتراوح ذاكرة بطاقة (Robson) من 64 ميغا بايت إلى 4 غيغا بايت. فكلما زادت الذاكرة، زاد مقدار البيانات أو عدد التطبيقات التي يمكنها الاستفادة من تقنية (Robson). ولقد تم الإعلان عن التقنية الجديدة مؤخرا في منتدى مبرمجي إنتل. إلا أن شركة إنتل لم تفصح عن موعد طرح التقنية بالأسواق. يذكر أن إنتل قد قامت بتطوير برنامج تقنية (Robson)، إلا أن شرائح الذاكرة ناند فلاش كانت من إنتاج شركات أخرى مثل سامسونج وتوشيبا وغيرهم.
